{
  "agent_protocol_version": "1.0.0",
  "device_id": "11111111-1111-4111-8111-111111111111",
  "device_secret": "AAAAAAAAAAAAAAAAAAAAAAAAAAAAAAAAAAAAAAAAAAA",
  "frp_token": "0000000000000000000000000000000000000000000000000000000000000000",
  "server_addr": "relay.example.com",
  "server_port": 7000,
  "server_name": "relay.example.com",
  "subdomain": "test1234",
  "domain_claim": "eyJkZXZpY2VfaWQiOiIxMTExMTExMS0xMTExLTQxMTEtODExMS0xMTExMTExMTExMTEiLCJzdWJkb21haW4iOiJ0ZXN0MTIzNCIsInRlbmFudF9pZCI6IjIyMjIyMjIyLTIyMjItNDIyMi04MjIyLTIyMjIyMjIyMjIyMiIsImlzc3VlZF9hdCI6IjIwMjYtMTAtMThUMDA6MDA6MDAuMDAwMDAxWiIsImtleV9pZCI6ImluaXRpYWwifQ.AAAAAAAAAAAAAAAAAAAAAAAAAAAAAAAAAAAAAAAAAAA",
  "relay_ca_pem": "-----BEGIN CERTIFICATE-----\nMIIBaTCCAQ6gAwIBAgIUJXr7iIQD/KkY/2mGPpUA01gUOn8wCgYIKoZIzj0EAwIw\nKDEmMCQGA1UEAwwdTmV0SHViIHB1YmxpYyB0ZXN0IGZpeHR1cmUgQ0EwHhcNMjYw\nMTAxMDAwMDAwWhcNMzYwMTAxMDAwMDAwWjAoMSYwJAYDVQQDDB1OZXRIdWIgcHVi\nbGljIHRlc3QgZml4dHVyZSBDQTBZMBMGByqGSM49AgEGCCqGSM49AwEHA0IABJ7E\nwLcP4P92pS0VdOD0C+8/trnVWzMKI5Q6p1OjsEdwsEi+iak7Hxej70zg3uJ6DmT9\nf/hN5zN3q0keHBa5piujFjAUMBIGA1UdEwEB/wQIMAYBAf8CAQAwCgYIKoZIzj0E\nAwIDSQAwRgIhAPsp8lNkT/YnPgIt1MSKuPpRjyn+P1aOUD2J4NUTpCQyAiEAw9AM\nA5Ks25n7TlGE+0yTIdWN4YZYoliRAFzFLiFf/Hs=\n-----END CERTIFICATE-----\n"
}
